{"schema_version":"claimwright.similarity_candidate_report.v1","artifact_sha256":"4053fb4e6bf13177fe2775141b9616ff591f71a841d173ebca5b009dbcf0a704","method":"offline exact phrase scan","tool_version":"fixture","corpus":"fixture corpus","corpus_limitations":["fixture only"],"candidates":[{"source_id":"source-1","artifact_location":"p. 1","overlap_kind":"exact","materiality":"not_material","disposition":"common_phrase","disposition_rationale":"Boilerplate phrase."}]}
